{
  "id": "b3e2f4a5-8c5d-4e3b-9f7a-1b8c5f4a5b2f",
  "user_id": "a1b2c3d4-5e6f-7a8b-9c0d-1e2f3a4b5c6d",
  "permissions": {
    "can_create_node": true,
    "can_edit_own_nodes": true,
    "can_moderate": false,
    "default_scope": "local",
    "moderation_scopes": [
      "node:review",
      "message:hide"
    ]
  },
  "created_at": "2024-01-10T08:00:00Z"
}
